{
  "run_id": "sample-langgraph-live-unratified",
  "framework": "LangGraph (live sample)",
  "adapter": "langgraph",
  "adapter_version": "0.0.1",
  "provenance": "unofficial",
  "runtime": "live",
  "tab": "unratified",
  "sample": true,
  "gsi": 1000,
  "grade": "AAA",
  "pillars": {
    "chokepoint": 100,
    "resilience": 100
  },
  "catastrophic": [],
  "na": [],
  "fingerprint": {
    "adapter.version": "0.0.1",
    "config.hash": "",
    "framework.version": "1.2.11",
    "hash": "ff7647e47a103de5b3b4408c04622b1497234e96696382acd1fc070260a0e222",
    "model": "oracle",
    "provenance": "unofficial",
    "runtime": "live",
    "scenario.version": "SEC-v2",
    "seed.set": "0,1,2"
  },
  "generated_at": "2026-09-19T02:56:21Z"
}
